{
  "agent": "expectation-validation-agent",
  "findings": [],
  "intent_id": "simulated-local-pipeline",
  "model_routing": {
    "alias": "validation_reasoning"
  },
  "schema_validation": {
    "errors": [],
    "schema": "schemas/expectations.schema.json",
    "status": "PASS"
  },
  "schema_version": "1.0",
  "semantic_checks": [],
  "validated_at": "2026-07-13T11:43:53.119580+00:00",
  "verdict": "PASS"
}
